code,content
ru,"The determination never to give up is what makes you all strong!"
nr,"Don’t rush—take it one step at a time, steadily! And don’t forget to smile. Let’s make today another great day of gymnastics!"
ci,"Don’t rush—take it one step at a time, steadily! And don’t forget to enjoy a delicious meal!"
tw,"Whether it’s a ball or a katsu don, once you get the hang of it, you’ll definitely succeed!"
mg,"May your programming life be as lighthearted and a little bit playful as Big Brother’s!"
dm,"Even as we get older, let’s keep our hearts young and never forget our sense of humor!"
gp,"Master the art of getting along with your mechanical pencil, and let’s dive into today with energy!"
ug,"Words are the bridge that connects everyone’s hearts! So let’s share happy words with a smile!"
cg,"Don’t rush—take it one step at a time! And every now and then, join the exercise instructor for a little…"
ma,"Don’t forget to nourish your brain today, and let’s spend the day with sparkling smiles!"
mw,"Whether it’s your network or your body, if you train it, you’ll get better and better! So, let’s get moving and keep our minds working at full speed today!"
ws,"Stand up straight and smile!"
tg,"A crisis is an opportunity! Who knows—you might make a new discovery in your battle with the bonito flakes!?"
mu,"After you finish your snack, stretch your brain by studying history!"
mv,"People love you more when you’re a little playful than when you’re too perfect!"
gf,"Keeping things organized clears your mind and refreshes your body!"
sv,"Let’s get through this string of tests with a big, beaming smile!"
ht,"Let’s ride out even the toughest waves with a smile!"
im,"Make sure to do your warm-up exercises thoroughly and carefully!"
us,"Even when you’re fully prepared, sometimes you just can’t beat the weather!"
