code,content
ru,"Even as automation advances, let’s keep our cheerful greetings manual!"
nr,"Even when things don’t go as planned, just laugh it off and move on!"
ci,"Get plenty of exercise while it’s still light out, and then get a good night’s sleep!"
tw,"Whether it’s a ball or a katsu don, once you get the hang of it, you’ll definitely succeed!"
mg,"May your programming life be as lighthearted and a little bit playful as Big Brother’s!"
dm,"Even as we get older, let’s keep our hearts young and never forget our sense of humor!"
gp,"Master the art of getting along with your mechanical pencil, and let’s dive into today with energy!"
ug,"Words are the bridge that connects everyone’s hearts! So let’s share happy words with a smile!"
cg,"Don’t rush—take it one step at a time! And every now and then, join the exercise instructor for a little…"
ma,"Instead of pushing yourself too hard, make sure to stay well-hydrated first!"
mw,"Whether it’s your network or your body, if you train it, you’ll get better and better! So, let’s get moving and keep our minds working at full speed today!"
ws,"Stand up straight and smile!"
tg,"A crisis is an opportunity! Who knows—you might make a new discovery in your battle with the bonito flakes!?"
mu,"After you finish your snack, stretch your brain by studying history!"
mv,"People love you more when you’re a little playful than when you’re too perfect!"
gf,"Keeping things organized clears your mind and refreshes your body!"
sv,"Let’s get through this string of tests with a big, beaming smile!"
ht,"Let’s learn to enjoy even the smallest changes!"
im,"Stand up straight and flash a smile!"
us,"Even when you’re fully prepared, sometimes you just can’t beat the weather!"
gu,"If you turn failures into laughter, they become the best memories!"
km,"When you’re feeling flustered, take a deep breath and stretch first!"
pl,"Stand up straight and flash a smile!"
fo,"Even if the wind blows you around, let’s keep our hearts moving straight ahead!"
dk,"When you feel the humidity, take a deep breath and refresh yourself!"
ga,"When planting flowers, start with some squats!"
to,"When you get hungry, make sure to wash your hands first to get ready!"
mc,"When you’re in a pinch, stay as calm as a table tennis serve!"
it,"Staying organized is like a stretch for your mind!"
eg,"Let’s spend the day feeling refreshed and invigorated with this light blue scenery!"
gr,"If you forget something, it’s okay—just remember it tomorrow!"
mz,"Even if you can do a lot, don’t overdo it!"
ca,"Don’t forget to stretch your mind, too!"
lr,"Even if you’re not fully prepared, it’s important to just give it a try!"
lb,"Failure is just a warm-up for your next success!"
cy,"Even on rainy days, keep your heart as bright as the sun!"
kz,"Don’t forget your warm-up exercises!"
ch,"Let’s keep going with a smile, a little bit every day!"
va,"Frustration is just the warm-up for your next leap!"
jm,"Stand up straight and smile!"
si,"Sleep is important, but the time you spend awake is even more important!"
nf,"If you spot a bee, take a deep breath and stay calm!"
lu,"After giving it your all, be sure to stretch thoroughly and let your body rest!"
pa,"Make sure to keep your appetite and exercise separate!"
ae,"Let’s keep smiling and aim for clear skies in our hearts, just like after the rain!"
il,"If you solidify your fundamentals, you’ll be able to jump even higher!"
my,"After passing the exam, let’s start by eating something delicious to recharge both our minds and bodies!"
ml,"Before worrying about the saddle, let’s make sure to keep our backs straight first!"
gd,"Even if your goal and the actual content don’t match, just take that first step!"
gs,"Failure is just the running start you need to jump even higher!"
uz,"Let’s laugh so loudly it drowns out the sound of mosquitoes!"
om,"You’re the coolest person in the world for taking on new challenges!"
cz,"Whether it’s difficult words or hijiki, let’s be greedy and enjoy them to the fullest!"
co,"Procrastination makes your mental muscles stiff!"
sz,"Stand up straight and flash a smile!"
fi,"Even if you get an error, jump with a smile!"
gm,"Even when strange things happen, let’s get through them with a smile!"
td,"You get to decide where your dreams take you!"
es,"Let’s turn all that delicious food into energy for tomorrow!"
yt,"Don’t set your goals so high that you end up flying off into the sky!"
nc,"Don’t forget to stay hydrated, and let’s have fun without pushing ourselves too hard!"
lv,"Be gentle with the handlebars, and keep an open mind!"
pt,"Take a good look around you, and take a great first step!"
sn,"Let’s make both our rooms and our hearts sparkle!"
et,"If you’re planning any crazy jumps, make sure to check with your big brother first!"
fj,"Cardboard is an important material for making dreams come true!"
